{
  "inbox_id": "INBOX-GH-000051",
  "github_issue_number": 51,
  "github_issue_url": "https://github.com/rafalbragan/-LibreDisplay/issues/51",
  "created_at": "2026-10-22T10:20:42Z",
  "updated_at": "2026-10-22T16:46:36Z",
  "submitted_by": "rafalbragan",
  "type": "IDEA",
  "persona": "WSPOLNE_LUB_NIE_WIEM",
  "module": "INNE_LUB_NIE_WIEM",
  "raw_input": "To jest WYŁĄCZNIE SYNTETYCZNE ZGŁOSZENIE TESTOWE. Sprawdzamy czy Product Inbox zapisuje wygenerowane rekordy na osobnej gałęzi i tworzy PR zamiast bezpośrednio zapisywać do master.",
  "why_it_matters": "Test integracyjny workflow po scaleniu PR #50; nie jest to realna prośba produktowa ani wymaganie do implementacji.",
  "context": "TEST-INTEGRATION-20261022. Nie używać /accept, nie zatwierdzać wymagania, nie uruchamiać implementacji. Każda analiza AI jest jedynie doradcza. Test nie upoważnia automatyzacji do decyzji PO.",
  "status": "ANALYZED"
}
