{
  "inbox_id": "INBOX-GH-000003",
  "github_issue_number": 3,
  "github_issue_url": "https://github.com/rafalbragan/-LibreDisplay/issues/3",
  "created_at": "2026-09-02T14:52:53Z",
  "updated_at": "2026-09-02T14:54:13Z",
  "submitted_by": "rafalbragan",
  "type": "IDEA",
  "persona": "WSPOLNE_LUB_NIE_WIEM",
  "module": "USTAWIENIA",
  "raw_input": "Chciałbym, żeby LibreCare zapamiętywał ostatnio wybrany tryb użytkownika: Opiekun, Senior albo Lekarz.\n\nPo ponownym uruchomieniu aplikacji użytkownik powinien wrócić do swojego poprzednio wybranego trybu, zamiast za każdym razem zaczynać od domyślnego trybu.\n\nTryb nadal musi być możliwy do ręcznego przełączenia w aplikacji.",
  "why_it_matters": "Te trzy tryby są przeznaczone dla różnych użytkowników i mają różne cele. Senior korzystający na co dzień z LibreCare nie powinien po każdym uruchomieniu trafiać do widoku Opiekuna i odwrotnie.",
  "context": "LibreCare ma już trzy perspektywy: Opiekun, Senior i Lekarz. To wymaganie dotyczy wyłącznie zapamiętania wyboru użytkownika między uruchomieniami aplikacji, bez zmiany funkcjonalności poszczególnych trybów.",
  "status": "ANALYZED"
}
